{
  "ref_id": "ref-005",
  "authorship": "analyst",
  "generator": "scripts/analyst.ts from analyst.src.yaml",
  "generated_at": "2026-10-02T16:36:30.534Z",
  "notes": "The probe's above-the-fold display detection missed the giant hero word (likely mid-animation when measured); maximum text size on the page is VERIFIED separately (654 px at 1440, 312 px at 390).",
  "observations": [
    {
      "id": "ref-005.typography.home-a-type-as-image",
      "ref_id": "ref-005",
      "page": "home",
      "source_url": "https://exat.hottype.co/",
      "capture_id": "20261002T163146Z",
      "captured_at": "2026-10-02T16:31:46.389Z",
      "viewport": "1440x900",
      "category": "typography",
      "property": "type-as-image",
      "value": "see statement",
      "evidence_type": "OBSERVED",
      "method": "screenshot",
      "evidence": [
        {
          "artifact": "research-artifacts/ref-005/home/20261002T163146Z/1440x900-top.jpg",
          "sha256": "dff222912afebcbc48beb25ffaa569918874ff72fd0c749dac83f6aa1e5758b6"
        }
      ],
      "statement": "The first viewport is the typeface name set in light letters hundreds of pixels tall on a flat saturated orange field, spanning the full width and bleeding off the bottom edge; header text is tiny by comparison (logo, product line, 'get font' link, menu).",
      "confidence": 0.95,
      "assessment": "strength",
      "tags": [
        "display",
        "specimen",
        "scale"
      ]
    },
    {
      "id": "ref-005.responsive.home-a-mobile-rotation",
      "ref_id": "ref-005",
      "page": "home",
      "source_url": "https://exat.hottype.co/",
      "capture_id": "20261002T163146Z",
      "captured_at": "2026-10-02T16:31:46.389Z",
      "viewport": "390x844",
      "category": "responsive",
      "property": "mobile-rotation",
      "value": "see statement",
      "evidence_type": "OBSERVED",
      "method": "screenshot",
      "evidence": [
        {
          "artifact": "research-artifacts/ref-005/home/20261002T163146Z/390x844-top.jpg",
          "sha256": "1dd61401149678b25f040c1dfba6d591bf500a1eefb2d70341155f5c8fc53270"
        },
        {
          "artifact": "research-artifacts/ref-005/home/20261002T163146Z/1440x900-top.jpg",
          "sha256": "dff222912afebcbc48beb25ffaa569918874ff72fd0c749dac83f6aa1e5758b6"
        }
      ],
      "statement": "At 390 the giant word is rotated 90° to run vertically up the right side of the tall viewport, keeping its letters huge; the product line and the 'get font' link sit small at the left.",
      "confidence": 0.9,
      "assessment": "strength",
      "tags": [
        "reorientation",
        "mobile-transform"
      ]
    },
    {
      "id": "ref-005.layout.home-a-poster-modules",
      "ref_id": "ref-005",
      "page": "home",
      "source_url": "https://exat.hottype.co/",
      "capture_id": "20261002T163146Z",
      "captured_at": "2026-10-02T16:31:46.389Z",
      "viewport": "1440x900",
      "category": "layout",
      "property": "poster-modules",
      "value": "see statement",
      "evidence_type": "OBSERVED",
      "method": "screenshot",
      "evidence": [
        {
          "artifact": "research-artifacts/ref-005/home/20261002T163146Z/1440x900-scroll-25.jpg",
          "sha256": "22b4af376648ec32ef399381a67da3e097efa34a3a4e16c6250dadc14ec7d738"
        },
        {
          "artifact": "research-artifacts/ref-005/home/20261002T163146Z/1440x900-scroll-50.jpg",
          "sha256": "776f17ff19fd3f83d650c2d8e471e5f4d993ee4f6cf4a1ee9d966a6b0317b7de"
        }
      ],
      "statement": "Further down, flat colour bands (yellow, black) hold large statements, and specimen modules sit in a modular grid like modernist posters: cut numerals, a list of names, a single huge letter on a colour block, a dot pattern, a spiral of alphabet in graded colours; small captions set very tight.",
      "confidence": 0.85,
      "assessment": "strength",
      "tags": [
        "modernist",
        "grid",
        "specimen"
      ]
    },
    {
      "id": "ref-005.color.home-a-saturated-flat-palette",
      "ref_id": "ref-005",
      "page": "home",
      "source_url": "https://exat.hottype.co/",
      "capture_id": "20261002T163146Z",
      "captured_at": "2026-10-02T16:31:46.389Z",
      "viewport": "cross-viewport",
      "category": "color",
      "property": "saturated-flat-palette",
      "value": "see statement",
      "evidence_type": "OBSERVED",
      "method": "screenshot",
      "evidence": [
        {
          "artifact": "research-artifacts/ref-005/home/20261002T163146Z/1440x900-top.jpg",
          "sha256": "dff222912afebcbc48beb25ffaa569918874ff72fd0c749dac83f6aa1e5758b6"
        },
        {
          "artifact": "research-artifacts/ref-005/home/20261002T163146Z/1440x900-scroll-25.jpg",
          "sha256": "22b4af376648ec32ef399381a67da3e097efa34a3a4e16c6250dadc14ec7d738"
        },
        {
          "artifact": "research-artifacts/ref-005/home/20261002T163146Z/1440x900-scroll-50.jpg",
          "sha256": "776f17ff19fd3f83d650c2d8e471e5f4d993ee4f6cf4a1ee9d966a6b0317b7de"
        }
      ],
      "statement": "Palette of flat saturated orange, yellow, pink, green, blue and near-black on off-white — no gradients, shadows or blur; colour blocks are the layout units.",
      "confidence": 0.9,
      "assessment": "neutral",
      "tags": [
        "flat-colour"
      ]
    },
    {
      "id": "ref-005.typography.home-a-why-type-as-image",
      "ref_id": "ref-005",
      "page": "home",
      "source_url": "https://exat.hottype.co/",
      "capture_id": "20261002T163146Z",
      "captured_at": "2026-10-02T16:31:46.389Z",
      "viewport": "cross-viewport",
      "category": "typography",
      "property": "why-type-as-image",
      "value": "see statement",
      "evidence_type": "INFERRED",
      "method": "analyst-judgment",
      "evidence": [
        {
          "observation": "ref-005.typography.home-a-type-as-image"
        },
        {
          "observation": "ref-005.responsive.home-a-mobile-rotation"
        },
        {
          "observation": "ref-005.typography.home-1440-max-size"
        }
      ],
      "statement": "When the product is a typeface, enormous letterforms are the product demonstration, so extreme display scale (largest text ≈ 40× body at 1440) is justified by the goal. The rotation on mobile shows the principle: preserve the decisive scale relationship by changing orientation rather than shrinking the word to fit.",
      "confidence": 0.75,
      "assessment": "strength",
      "tags": [
        "scale",
        "context"
      ]
    },
    {
      "id": "ref-005.typography.home-a-why-not-general",
      "ref_id": "ref-005",
      "page": "home",
      "source_url": "https://exat.hottype.co/",
      "capture_id": "20261002T163146Z",
      "captured_at": "2026-10-02T16:31:46.389Z",
      "viewport": "cross-viewport",
      "category": "typography",
      "property": "why-not-general",
      "value": "see statement",
      "evidence_type": "INFERRED",
      "method": "analyst-judgment",
      "evidence": [
        {
          "observation": "ref-005.typography.home-a-type-as-image"
        },
        {
          "observation": "ref-005.layout.home-a-poster-modules"
        }
      ],
      "statement": "The rotated giant word and the alphabet spiral are this site's signature moves tied to a type-specimen brief; on a page whose product is not typography they would be decoration that pushes content below the fold.",
      "confidence": 0.7,
      "assessment": "neutral",
      "tags": [
        "signature"
      ]
    },
    {
      "id": "ref-005.accessibility.home-a-why-contrast-and-structure",
      "ref_id": "ref-005",
      "page": "home",
      "source_url": "https://exat.hottype.co/",
      "capture_id": "20261002T163146Z",
      "captured_at": "2026-10-02T16:31:46.389Z",
      "viewport": "cross-viewport",
      "category": "accessibility",
      "property": "why-contrast-and-structure",
      "value": "see statement",
      "evidence_type": "INFERRED",
      "method": "analyst-judgment",
      "evidence": [
        {
          "observation": "ref-005.layout.home-a-poster-modules"
        },
        {
          "observation": "ref-005.accessibility.home-1440-axe-by-impact"
        },
        {
          "observation": "ref-005.accessibility.home-390-axe-by-impact"
        }
      ],
      "statement": "Coloured poster modules and tight small captions generate serious colour-contrast findings (33 nodes at 1440, 77 at 390) and the page has no h1; specimen pages trade semantic structure and small-text legibility for poster aesthetics.",
      "confidence": 0.7,
      "assessment": "weakness",
      "tags": [
        "contrast",
        "headings"
      ]
    }
  ]
}
